item,item_en,item_id,2025,2024,2023,2022,2021,2020,2019,2018
"Tiền mặt, vàng bạc, đá quý",Cash and precious metals,bsa2,8624548000000.0,5696449000000.0,6909300000000.0,8460892000000.0,7509877000000.0,6967918000000.0,6437812000000.0,6129169000000.0
Tài sản cố định,Fixed assets,bsa29,5438550000000.0,5412370000000.0,4762561000000.0,3981376000000.0,3762548000000.0,3782753000000.0,3770219000000.0,3233388000000.0
Tài sản cố định hữu hình,Tangible fixed assets,bsa30,3200487000000.0,3222198000000.0,3317568000000.0,2849732000000.0,2685070000000.0,2716915000000.0,2721100000000.0,2640643000000.0
Nguyên giá TSCĐ hữu hình,Cost,bsa31,6806108000000.0,6504276000000.0,6256911000000.0,5523787000000.0,5123414000000.0,4949479000000.0,4737359000000.0,4414779000000.0
Hao mòn TSCĐ hữu hình,Accumulated depreciation,bsa32,-3605621000000.0,-3282078000000.0,-2939343000000.0,-2674055000000.0,-2438344000000.0,-2232564000000.0,-2016259000000.0,-1774136000000.0
Tài sản cố định thuê tài chính,Finance leased assets,bsa33,0.0,0.0,0.0,0.0,0.0,0.0,0.0,0.0
Nguyên giá TSCĐ thuê tài chính,Cost,bsa34,0.0,0.0,0.0,0.0,0.0,0.0,0.0,0.0
Hao mòn TSCĐ thuê tài chính,Accumulated depreciation,bsa35,0.0,0.0,0.0,0.0,0.0,0.0,0.0,0.0
Tài sản cố định vô hình,Intangible fixed assets,bsa36,2238063000000.0,2190172000000.0,1444993000000.0,1131644000000.0,1077478000000.0,1065838000000.0,1049119000000.0,592745000000.0
Nguyên giá TSCĐ vô hình,Cost,bsa37,3117527000000.0,2950265000000.0,2101677000000.0,1709488000000.0,1579813000000.0,1495882000000.0,1409414000000.0,894744000000.0
Hao mòn TSCĐ vô hình,Accumulated amortization,bsa38,-879464000000.0,-760093000000.0,-656684000000.0,-577844000000.0,-502335000000.0,-430044000000.0,-360295000000.0,-301999000000.0
Bất động sản đầu tư,Investment properties,bsa40,149673000000.0,177005000000.0,177005000000.0,177005000000.0,216027000000.0,348778000000.0,361676000000.0,247454000000.0
Nguyên giá bất động sản đầu tư,Historical cost,bsa41,149692000000.0,177005000000.0,177005000000.0,177005000000.0,216027000000.0,356358000000.0,364877000000.0,249749000000.0
Hao mòn bất động sản đầu tư,Accumulated depreciation,bsa42,-19000000.0,0.0,0.0,0.0,0.0,-7580000000.0,-3201000000.0,-2295000000.0
"Góp vốn, đầu tư dài hạn",Investment in other entities and long term investments,bsa43,74699000000.0,124935000000.0,140025000000.0,146814000000.0,171925000000.0,99489000000.0,97884000000.0,155975000000.0
Đầu tư vào công ty con,Investment in subsidiaries,bsa44,0.0,0.0,0.0,0.0,0.0,0.0,0.0,0.0
Đầu tư vào công ty liên doanh,Investment in associate companies,bsa45,0.0,0.0,0.0,0.0,0.0,2967000000.0,1441000000.0,1398000000.0
Đầu tư dài hạn khác,Other Long-term investments,bsa46,233739000000.0,292867000000.0,303387000000.0,303387000000.0,299317000000.0,101827000000.0,101827000000.0,159927000000.0
Dự phòng giảm giá đầu tư dài hạn,Provision for long-term investments,bsa47,-159040000000.0,-167932000000.0,-163362000000.0,-156573000000.0,-127392000000.0,-5305000000.0,-5384000000.0,-5350000000.0
TỔNG TÀI SẢN,TOTAL ASSETS,bsa53,1025850127000000.0,864005703000000.0,718794589000000.0,607875185000000.0,527769944000000.0,444530104000000.0,383514439000000.0,329333241000000.0
TỔNG NỢ PHẢI TRẢ,TOTAL LIABILITIES,bsa54,931330408000000.0,780544025000000.0,647838628000000.0,549436522000000.0,482869035000000.0,409081941000000.0,355749080000000.0,308315342000000.0
VỐN CHỦ SỞ HỮU,OWNER'S EQUITY,bsa78,94519719000000.0,83461678000000.0,70955961000000.0,58438663000000.0,44900909000000.0,35448163000000.0,27765359000000.0,21017899000000.0
Vốn điều lệ,Charter capital,bsa80,51366566000000.0,44666579000000.0,38840504000000.0,33774351000000.0,27019481000000.0,21615585000000.0,16627373000000.0,12885877000000.0
Thặng dư vốn cổ phần,Capital surplus,bsa81,271779000000.0,271779000000.0,271779000000.0,271779000000.0,271779000000.0,271779000000.0,271779000000.0,0.0
Vốn khác,Owner's other capital,bsa82,0.0,0.0,0.0,0.0,0.0,0.0,0.0,0.0
Cổ phiếu Quỹ,Treasury shares,bsa83,0.0,0.0,0.0,0.0,0.0,0.0,-99981000000.0,-665725000000.0
Chênh lệch đánh giá lại tài sản,Difference upon assets revaluation,bsa84,0.0,0.0,0.0,0.0,0.0,0.0,0.0,0.0
Chênh lệch tỷ giá hối đoái,Foreign currency difference reserve,bsa85,0.0,0.0,0.0,0.0,0.0,0.0,0.0,0.0
Lợi nhuận chưa phân phối,Retained Earnings,bsa90,25298313000000.0,23733752000000.0,20286243000000.0,15172408000000.0,10445352000000.0,7819040000000.0,6370286000000.0,5104678000000.0
Lợi ích của cổ đông thiểu số (trước 2015),Minority interest (Before 2015),bsa95,0.0,0.0,0.0,0.0,0.0,0.0,0.0,0.0
NỢ PHẢI TRẢ VÀ VỐN CHỦ SỞ HỮU,LIABILITIES AND SHAREHOLDER'S EQUITY,bsa96,1025850127000000.0,864005703000000.0,718794589000000.0,607875185000000.0,527769944000000.0,444530104000000.0,383514439000000.0,329333241000000.0
Tiền gửi tại Ngân hàng nhà nước Việt Nam,Balances with the SBV,bsb97,16574958000000.0,25219753000000.0,18504814000000.0,13657531000000.0,32349574000000.0,16616798000000.0,10420306000000.0,10683536000000.0
Tiền gửi tại các TCTD khác và cho vay các TCTD khác,Placements with and loans to other credit institutions,bsb98,149990681000000.0,117882259000000.0,114873931000000.0,85971313000000.0,49818776000000.0,31671245000000.0,30341599000000.0,18769776000000.0
Chứng khoán kinh doanh,"Trading securities, net",bsb99,6544882000000.0,3881151000000.0,7177069000000.0,1131327000000.0,11259731000000.0,6167917000000.0,2985262000000.0,1177972000000.0
Chứng khoán kinh doanh,Trading securities,bsb100,6708358000000.0,4029088000000.0,7323489000000.0,1320941000000.0,11325371000000.0,6285763000000.0,3145903000000.0,1339157000000.0
Dự phòng giảm giá chứng khoán kinh doanh,Less: Provision for diminution in value of trading securities,bsb101,-163476000000.0,-147937000000.0,-146420000000.0,-189614000000.0,-65640000000.0,-117846000000.0,-160641000000.0,-161185000000.0
Các công cụ tài chính phái sinh và các tài sản tài chính khác,Derivatives and other financial assets,bsb102,324298000000.0,55992000000.0,0.0,100072000000.0,226545000000.0,54473000000.0,87753000000.0,0.0
Cho vay khách hàng,"Loans and advances to customers, net",bsb103,679152623000000.0,573946692000000.0,482234900000000.0,408856508000000.0,356050950000000.0,308528625000000.0,266164852000000.0,227983048000000.0
Cho vay khách hàng,Loans and advances to customers,bsb104,686777352000000.0,580686248000000.0,487601852000000.0,413706244000000.0,361912538000000.0,311478989000000.0,268700541000000.0,230527220000000.0
Dự phòng rủi ro cho vay khách hàng,Less: Provision for losses on loans and advances to customers,bsb105,-7624729000000.0,-6739556000000.0,-5366952000000.0,-4849736000000.0,-5861588000000.0,-2950364000000.0,-2535689000000.0,-2544172000000.0
Chứng khoán đầu tư,Investment securities,bsb106,144164116000000.0,121090243000000.0,73463347000000.0,75534794000000.0,59474604000000.0,63399011000000.0,55956160000000.0,53380061000000.0
Chứng khoán đầu tư sẵn sàng để bán,Available-for-sales securities,bsb107,132778839000000.0,108918477000000.0,44903768000000.0,31854915000000.0,9739539000000.0,10790432000000.0,10601503000000.0,8201643000000.0
Chứng khoán đầu tư giữ đến ngày đáo hạn,Held-to-maturity securities,bsb108,11396527000000.0,12171766000000.0,28559579000000.0,43679879000000.0,49743071000000.0,53048264000000.0,45821522000000.0,45635016000000.0
Dự phòng giảm giá chứng khoán đầu tư,Provision for diminution in value of investment securities,bsb109,-11250000000.0,0.0,0.0,0.0,-8006000000.0,-439685000000.0,-466865000000.0,-456598000000.0
Tài sản Có khác,Other assets,bsb110,14811099000000.0,10518854000000.0,10551637000000.0,9857553000000.0,6929387000000.0,6893097000000.0,6890916000000.0,7572862000000.0
Các khoản nợ chính phủ và NHNN Việt Nam,Due to Gov and Loans from SBV,bsb111,32976139000000.0,7954853000000.0,88000000.0,505876000000.0,0.0,0.0,0.0,3074100000000.0
Tiền gửi và vay các Tổ chức tín dụng khác,Deposits and Loans from other credit institutions,bsb112,154999539000000.0,111591668000000.0,89506662000000.0,67840840000000.0,54393939000000.0,23875242000000.0,19248572000000.0,20718382000000.0
Tiền gửi của khách hàng,Deposits from customers,bsb113,585180175000000.0,537304578000000.0,482702731000000.0,413952789000000.0,379920669000000.0,353195838000000.0,308129391000000.0,269998503000000.0
Các công cụ tài chính phái sinh và các khoản nợ tài chính khác,Derivatives and other financial liabilities,bsb114,0.0,0.0,117126000000.0,0.0,0.0,0.0,0.0,38198000000.0
"Vốn tài trợ, uỷ thác đầu tư của Chính phủ và các tổ chức tín dụng khác","Funds received from Gov, international and other institutions",bsb115,19079000000.0,28008000000.0,41534000000.0,60188000000.0,86066000000.0,116705000000.0,156147000000.0,160093000000.0
Phát hành giấy tờ có giá,Convertible bonds/CDs and other valuable papers issued,bsb116,133294422000000.0,101650446000000.0,52410014000000.0,44304367000000.0,30547883000000.0,22049697000000.0,20830836000000.0,8290918000000.0
Các khoản nợ khác,Other liabilities,bsb117,24861054000000.0,22014472000000.0,23060473000000.0,22772462000000.0,17920478000000.0,9844459000000.0,7384134000000.0,6035148000000.0
Vốn của tổ chức tín dụng,Capital,bsb118,51638345000000.0,44938358000000.0,39112283000000.0,34046130000000.0,27291260000000.0,21887364000000.0,16799171000000.0,12220152000000.0
Vốn đầu tư XDCB,Fund for basic construction,bsb119,0.0,0.0,0.0,0.0,0.0,0.0,0.0,0.0
Cổ phiếu ưu đãi,Preferred shares,bsb120,0.0,0.0,0.0,0.0,0.0,0.0,0.0,0.0
Quỹ của tổ chức tín dụng,Reserves,bsb121,17583061000000.0,14789568000000.0,11557435000000.0,9220125000000.0,7164297000000.0,5741759000000.0,4595902000000.0,3693069000000.0
Bảo lãnh khác,Other guarantee,bsb131,19772573000000.0,15330856000000.0,11922874000000.0,9579729000000.0,8389456000000.0,7726325000000.0,7218578000000.0,6265941000000.0
Cam kết giao dịch hối đoái,Foreign exchange transactions commitments,bsb158,83036000000.0,54784000000.0,42766000000.0,55386000000.0,62456000000.0,75723000000.0,50599000000.0,40060000000.0
Cam kết mua ngoại tệ,Foreign exchange buying commitments,bsb180,3176017000000.0,1671699000000.0,1527131000000.0,946516000000.0,568404000000.0,1206679000000.0,1711469000000.0,1157464000000.0
Cam kết bán ngoại tệ,Foreign exchange selling commitments,bsb181,2189273000000.0,1865951000000.0,704551000000.0,1178698000000.0,579774000000.0,975731000000.0,1175882000000.0,42324000000.0
Cam kết giao dịch hoán đổi,Swap commitments,bsb182,160078773000000.0,192286538000000.0,132722253000000.0,59919528000000.0,76552717000000.0,57092322000000.0,41478260000000.0,35417118000000.0
Cam kết giao dịch tương lai,Future commitments,bsb183,0.0,0.0,0.0,0.0,0.0,0.0,0.0,0.0
Cam kết cho vay không hủy ngang,Irrevocable loan commitments,bsb184,0.0,0.0,0.0,0.0,0.0,0.0,0.0,0.0
Cam kết trong nghiệp vụ L/C,Letters of credit commitments,bsb185,6666479000000.0,3519014000000.0,2183846000000.0,2777938000000.0,4005740000000.0,4585085000000.0,4998346000000.0,3086779000000.0
Cam kết khác,Other commitments,bsb186,25031882000000.0,28349409000000.0,14410228000000.0,6490910000000.0,4655536000000.0,2841427000000.0,0.0,0.0
Lợi ích của cổ đông thiểu số,Minority interest,bsa210,0.0,0.0,0.0,0.0,0.0,0.0,0.0,0.0
Tiền gửi tại các TCTD khác,Balances with other credit institutions,bsb258,149990681000000.0,117781280000000.0,114644002000000.0,82338762000000.0,43713230000000.0,23311116000000.0,19390796000000.0,12983626000000.0
Cho vay các TCTD khác,Loans to other credit institutions,bsb259,0.0,150979000000.0,279929000000.0,3682551000000.0,6105546000000.0,8360129000000.0,11051317000000.0,5926542000000.0
Dự phòng rủi ro,Allowance for balances with and loans to other credit institutions,bsb260,0.0,-50000000000.0,-50000000000.0,-50000000000.0,0.0,0.0,-100514000000.0,-140392000000.0
Hoạt động mua nợ,Debt Buying,bsb261,0.0,0.0,0.0,0.0,0.0,0.0,0.0,0.0
Mua nợ,Debt Buying,bsb262,0.0,0.0,0.0,0.0,0.0,0.0,0.0,0.0
Dự phòng rủi ro hoạt động mua nợ,Provision for losses on debt buying,bsb263,0.0,0.0,0.0,0.0,0.0,0.0,0.0,0.0
Các khoản phải thu,Other receivables,bsb264,6743073000000.0,4299649000000.0,5316951000000.0,4756992000000.0,3023499000000.0,3045690000000.0,3740459000000.0,4393501000000.0
Các khoản lãi và phí phải thu,Accrued interest and fee receivables,bsb265,6819629000000.0,4954367000000.0,4282669000000.0,4089550000000.0,3171877000000.0,3638207000000.0,3676311000000.0,3456607000000.0
Tài sản thuế TNDN hoãn lại,Deferred tax assets,bsb266,17263000000.0,17318000000.0,33722000000.0,63966000000.0,44370000000.0,50724000000.0,23041000000.0,65503000000.0
Tài sản Có khác,Other assets,bsb267,1414349000000.0,1425899000000.0,1117080000000.0,1143212000000.0,869602000000.0,1115297000000.0,1054539000000.0,982213000000.0
Trong đó: Lợi thế thương mại,In which: Goodwill,bsb268,0.0,0.0,0.0,0.0,0.0,0.0,0.0,0.0
Các khoản dự phòng rủi ro cho các tài sản Có nội bảng khác,Provision for other assets,bsb269,-183215000000.0,-178379000000.0,-198785000000.0,-196167000000.0,-179961000000.0,-956821000000.0,-1603434000000.0,-1324962000000.0
Tiền gửi của các tổ chức tín dụng khác,Deposits and Loans from other credit institutions,bsb270,121314141000000.0,91573962000000.0,80719473000000.0,60002732000000.0,41380571000000.0,15081349000000.0,16673949000000.0,17173804000000.0
Vay các tổ chức tín dụng khác,Loans from other credit institutions,bsb271,33685398000000.0,20017706000000.0,8787189000000.0,7838108000000.0,13013368000000.0,8793893000000.0,2574623000000.0,3544578000000.0
"Các khoản lãi, phí phải trả",Accrued interest and fee payables,bsb272,8969078000000.0,7045361000000.0,7682185000000.0,5564271000000.0,4637581000000.0,5097042000000.0,4362770000000.0,3409191000000.0
Thuế TNDN hoãn lại phải trả,Deferred tax liabilities,bsb273,0.0,0.0,0.0,0.0,0.0,67000000.0,0.0,0.0
Các khoản phải trả và công nợ khác,Other liabilities,bsb274,15891976000000.0,14969111000000.0,15378288000000.0,17208191000000.0,13282897000000.0,4747350000000.0,3021364000000.0,2625957000000.0
Dự phòng rủi ro khác,Allowance for other liabilities,bsb275,0.0,0.0,0.0,0.0,0.0,0.0,0.0,0.0
Vốn Góp liên doanh,Investments in joint-venture,bsa276,0.0,0.0,0.0,0.0,0.0,856000000.0,902000000.0,933000000.0
Đầu tư vào công ty liên kết,Investments in associates,bsa277,0.0,0.0,0.0,0.0,0.0,2111000000.0,539000000.0,465000000.0
